{
  "schema_version": "1.0",
  "entry_id": "0180",
  "lore_name": "きさらぎ駅",
  "summary": {
    "narrative": "2004年1月8日深夜から9日未明、投稿者「はすみ」は普段利用する静岡県内の私鉄で帰宅中、通常なら数分ごとに停車する列車が20分以上停車しないことに違和感を覚え、匿名掲示板へ実況相談する。列車は通常路線に存在しないはずのトンネルを通過し、見覚えのない無人駅「きさらぎ駅」へ停車する。下車後、駅は検索や家族・警察・位置情報でも通常世界の地理へ回収できない。はすみは線路沿いへ移動し、太鼓・鈴のような音、片足の老人、「伊佐貫」と読めるトンネル等を報告する。トンネル後に不審な人物の車へ乗り、「比奈」と説明されるが車は山側へ進み、運転者の挙動も不自然になる。はすみは逃走機会をうかがうと書き、レス635を最後に投稿が途絶える。初期ログ内では帰還・所在・身体状態・真相は確定しない。参加者は通常説明、異界、あの世等を含む複数解釈と助言をリアルタイムに返すが、相互に一致せず、安定した世界規則や確実な帰還法へ収束しない。後代の類似体験談、異界駅一般化、翻案、遠州鉄道等による再提示は初期形と分離する。",
    "structure": {
      "primary_actors": {
        "status": "known",
        "value": [
          "はすみ（投稿者・体験者）",
          "スレッド参加者",
          "片足の老人",
          "車の運転者"
        ]
      },
      "affected_targets": {
        "status": "known",
        "value": [
          "はすみ"
        ]
      },
      "entry_trigger": {
        "status": "known",
        "value": [
          "通常の帰宅乗車中に非意図的に異常へ巻き込まれる"
        ]
      },
      "causal_agent": {
        "status": "unknown",
        "value": null
      },
      "mechanism": {
        "status": "known",
        "value": [
          "通常路線では説明できない空間・経路異常",
          "位置特定不能",
          "段階的な異常事象の進行"
        ]
      },
      "state_transition": {
        "status": "known",
        "value": [
          "通常の帰宅移動→長時間無停車→未知駅→通常地理への回収失敗→線路移動→異常人物・トンネル→不審な車→投稿停止"
        ]
      },
      "temporal_structure": {
        "status": "known",
        "value": [
          "2004年1月8日深夜〜9日未明の一晩で段階進行",
          "レス98〜635のリアルタイム実況"
        ]
      },
      "rules_and_taboos": {
        "status": "known",
        "value": [
          "安定した世界規則は確定しない",
          "参加者助言は相互に不一致"
        ]
      },
      "avoidance_control": {
        "status": "known",
        "value": [
          "家族・警察・位置情報・参加者助言等を試すが確実な帰還法へ収束しない"
        ]
      },
      "terminal_state": {
        "status": "known",
        "value": [
          "不審な車内で逃走機会をうかがう旨を最後に投稿停止",
          "帰還・失踪・死亡・負傷・最終所在地は未確定"
        ]
      },
      "uncertainties": {
        "status": "known",
        "value": [
          "投稿内容の現実事実性／創作性は未確定",
          "異界・あの世等は参加者解釈で原因源として未確定",
          "投稿停止を失踪・死亡へ変換しない",
          "後代異界駅ルール・追体験・翻案を初期形へ遡及しない"
        ]
      },
      "variant_boundaries": {
        "status": "known",
        "value": [
          "VAR-001: 2004年初期実況レス98〜635",
          "VAR-002: 後代の異界駅一般化・追体験・帰還法増補",
          "VAR-003: 遠州鉄道等の後代事業者・翻案コンテンツ"
        ]
      }
    }
  },
  "content_units": [
    {
      "content_id": "CNT-001",
      "type": "event",
      "text": "2004年1月8日深夜から9日未明、はすみは公開掲示板で異常な帰宅列車の実況相談を開始する。",
      "evidence_refs": [
        "EVD-001",
        "EVD-010"
      ]
    },
    {
      "content_id": "CNT-002",
      "type": "event",
      "text": "普段なら数分ごとに停車する列車が20分以上停車せず、周囲の乗客は眠り、車掌・運転士側を確認できず、通常路線にないはずのトンネルを通過したと報告する。",
      "evidence_refs": [
        "EVD-002"
      ]
    },
    {
      "content_id": "CNT-003",
      "type": "event",
      "text": "列車は見覚えのない無人駅「きさらぎ駅」へ停車し、はすみは下車する。",
      "evidence_refs": [
        "EVD-003"
      ]
    },
    {
      "content_id": "CNT-004",
      "type": "claim",
      "text": "「きさらぎ駅」は通常の駅として検索等で確認できず、家族や位置情報でも通常世界の地理へ位置づけられない。",
      "evidence_refs": [
        "EVD-003",
        "EVD-004"
      ],
      "notes": "駅の実在・異世界性の確定ではなく、初期ログ内での位置特定不能を記録する。"
    },
    {
      "content_id": "CNT-005",
      "type": "action",
      "text": "はすみは家族、タクシー、携帯電話の位置情報、警察への連絡を試し、線路沿いに移動する。レス380では110番したが位置特定には至らなかったと報告する。",
      "evidence_refs": [
        "EVD-004"
      ]
    },
    {
      "content_id": "CNT-006",
      "type": "event",
      "text": "線路沿い移動中、太鼓と鈴のような音、片足の老人による警告と消失、「伊佐貫」と読めるトンネルへの到達を報告する。",
      "evidence_refs": [
        "EVD-005"
      ]
    },
    {
      "content_id": "CNT-007",
      "type": "event",
      "text": "トンネル通過後、はすみは近くにいた人物の車へ乗り、運転者から現在地を「比奈」と説明される。",
      "evidence_refs": [
        "EVD-006"
      ]
    },
    {
      "content_id": "CNT-008",
      "type": "event",
      "text": "車は山側へ進み、運転者は会話をやめ意味不明な独り言を始める。はすみは逃走機会をうかがうと投稿する。",
      "evidence_refs": [
        "EVD-006"
      ]
    },
    {
      "content_id": "CNT-009",
      "type": "outcome",
      "text": "レス635を最後に投稿が途絶え、初期ログ内では帰還・所在・身体状態・真相が確定しない。",
      "evidence_refs": [
        "EVD-006"
      ],
      "notes": "投稿停止を失踪・死亡・負傷へ変換しない。"
    },
    {
      "content_id": "CNT-010",
      "type": "action",
      "text": "スレッド参加者は検索・質問・助言・解釈をリアルタイムに返し、投稿者の逐次報告と参加者応答の往復で実況が進行する。",
      "evidence_refs": [
        "EVD-007",
        "EVD-010"
      ]
    },
    {
      "content_id": "CNT-011",
      "type": "claim",
      "text": "参加者は通常説明のほか異界・あの世等の解釈を提示するが、いずれも確定原因・世界構造にはならない。",
      "evidence_refs": [
        "EVD-007"
      ],
      "notes": "参加者解釈を投稿者自身の確定ontologyへ昇格しない。"
    },
    {
      "content_id": "CNT-012",
      "type": "rule",
      "text": "参加者による移動・帰還助言は相互に一致せず、初期ログ内で安定した世界規則や検証済み帰還法へ収束しない。",
      "evidence_refs": [
        "EVD-008"
      ]
    },
    {
      "content_id": "CNT-013",
      "type": "location",
      "text": "新浜松、静岡県内の私鉄、比奈等の実在地名・交通背景へ具体的に接続する一方、「きさらぎ駅」「伊佐貫トンネル」は通常地理上で確認できない場所として報告される。",
      "evidence_refs": [
        "EVD-009"
      ]
    },
    {
      "content_id": "CNT-014",
      "type": "claim",
      "text": "初期実況は、投稿者の一人称現在進行形報告と、不特定多数の参加者応答が一体化した公開Web共同実況として提示される。",
      "evidence_refs": [
        "EVD-010"
      ]
    },
    {
      "content_id": "CNT-015",
      "type": "claim",
      "text": "後代に遠州鉄道が「きさらぎ駅」を公式Webコンテンツとして再提示している。",
      "evidence_refs": [
        "EVD-011"
      ],
      "notes": "後代受容史であり、2004年初期実況のContent・因果規則・D18 L3へ遡及しない。"
    },
    {
      "content_id": "CNT-016",
      "type": "claim",
      "text": "後代には類似体験談、異界駅一般化、確立した帰還法・駅共通ルール、映画・ゲーム・動画・漫画等の翻案が増殖したが、2004年初期実況とは分離して扱う。",
      "evidence_refs": [
        "EVD-008",
        "EVD-011"
      ],
      "notes": "個々の派生作品・追体験を初期Versionへ逆輸入しない。"
    },
    {
      "content_id": "CNT-017",
      "type": "claim",
      "text": "Geo-グラフィックによる後代整理でも、列車異常→未知駅→線路移動→老人→トンネル→車→投稿停止という初期実況の時系列が整理されている。",
      "evidence_refs": [
        "EVD-012"
      ],
      "notes": "Content裁定は一次ログを優先する。"
    }
  ],
  "variants": [
    {
      "variant_id": "VAR-001",
      "kind": "initial",
      "description": "2004年1月8日深夜〜9日未明、2ちゃんねる「身のまわりで変なことが起こったら実況するスレ26」のレス98〜635で進行した「はすみ」の初期実況。通常の帰宅列車から説明不能な経路・未知駅へ逸脱し、位置特定不能、線路移動、異常音、老人、トンネル、不審な車へ段階進行し、帰還・所在・真相未確定のまま投稿が途絶える。",
      "attestation": "5ちゃんねる公式過去ログでレス98〜635を直接確認。",
      "content_refs": [
        "CNT-001",
        "CNT-002",
        "CNT-003",
        "CNT-004",
        "CNT-005",
        "CNT-006",
        "CNT-007",
        "CNT-008",
        "CNT-009",
        "CNT-010",
        "CNT-011",
        "CNT-012",
        "CNT-013",
        "CNT-014"
      ],
      "evidence_refs": [
        "EVD-001",
        "EVD-002",
        "EVD-003",
        "EVD-004",
        "EVD-005",
        "EVD-006",
        "EVD-007",
        "EVD-008",
        "EVD-009",
        "EVD-010"
      ],
      "notes": "参加者の異界解釈は解釈候補として保持し、原因源を確定しない。投稿停止を失踪・死亡へ変換しない。"
    },
    {
      "variant_id": "VAR-002",
      "kind": "later",
      "description": "後代の追体験投稿、類似する「異界駅」、確立した帰還手順・禁止事項・駅共通ルール等の一般化・増補群。",
      "content_refs": [
        "CNT-016"
      ],
      "evidence_refs": [
        "EVD-008"
      ],
      "notes": "初期実況の世界規則・帰還法へ遡及しない。"
    },
    {
      "variant_id": "VAR-003",
      "kind": "later",
      "description": "遠州鉄道等の事業者公式コンテンツや映画・ゲーム・動画・漫画等の後代再提示・翻案。",
      "content_refs": [
        "CNT-015",
        "CNT-016"
      ],
      "evidence_refs": [
        "EVD-011"
      ],
      "notes": "後代受容・変容史として扱い、初期VersionのD18 L3や因果モデルへ逆輸入しない。"
    }
  ],
  "uncertainties": [
    {
      "text": "投稿内容が現実に起きた出来事か、創作・ロールプレイ・即興実況かは確定しない。",
      "evidence_refs": [
        "EVD-001",
        "EVD-010"
      ],
      "content_refs": [
        "CNT-001",
        "CNT-014"
      ]
    },
    {
      "text": "異界・あの世等は参加者の解釈候補であり、投稿者自身の確定説明や因果源として固定しない。",
      "evidence_refs": [
        "EVD-007"
      ],
      "content_refs": [
        "CNT-011"
      ]
    },
    {
      "text": "投稿停止後の帰還・所在・失踪・死亡・負傷・最終所在地は初期ログから確定しない。",
      "evidence_refs": [
        "EVD-006"
      ],
      "content_refs": [
        "CNT-009"
      ]
    },
    {
      "text": "参加者の助言は相互に不一致で、確実な帰還法・安定した世界規則として検証されていない。",
      "evidence_refs": [
        "EVD-008"
      ],
      "content_refs": [
        "CNT-012"
      ]
    },
    {
      "text": "後代の追体験、異界駅一般化、帰還法、翻案、事業者コンテンツを2004年初期実況へ遡及しない。",
      "evidence_refs": [
        "EVD-011"
      ],
      "content_refs": [
        "CNT-015",
        "CNT-016"
      ]
    },
    {
      "text": "新浜松・比奈等の実在地名への接続は、「きさらぎ駅」や「伊佐貫トンネル」の実在を意味しない。",
      "evidence_refs": [
        "EVD-009"
      ],
      "content_refs": [
        "CNT-013"
      ]
    }
  ]
}
